[
  {
    "claim_id": "4977147b-023c-422a-b836-d98edc44333d",
    "claim_text": "On July 31, the president established 10 percent tariffs on countries with which the US runs a surplus.",
    "subject": "Countries with which the US runs a trade surplus",
    "tariff_action": "new_tariff",
    "effective_date": "2025-07-31",
    "source_url": "https://ustr.gov/about/policy-offices/press-office/blogs-and-op-eds/2025/year-tariff",
    "source_name": "USTR",
    "published_date": "2026-03-04T18:50:51+00:00",
    "extracted_date": "2026-03-05T09:51:08.616520+00:00",
    "certainty_level": 5,
    "certainty_label": "EXECUTIVE_ORDER",
    "certainty_rationale": "The claim uses past-tense language ('established') describing a specific presidential action on a specific date from an official USTR source, indicating a signed executive order or proclamation rather than an announcement of future intent.",
    "pedigree": {
      "source_name": "USTR",
      "source_category": "official_us_gov",
      "source_url": "https://ustr.gov/about/policy-offices/press-office/blogs-and-op-eds/2025/year-tariff",
      "published_date": "2026-03-04T18:50:51+00:00",
      "extracted_date": "2026-03-05T09:51:08.616520+00:00",
      "certainty_level": 5
    },
    "feed_exclude": false
  },
  {
    "claim_id": "781317d1-e933-4868-8c11-2afbc38e2372",
    "claim_text": "On July 31, the president established 15 percent tariffs on countries with which the US has a small deficit.",
    "subject": "Countries with which the US has a small trade deficit",
    "tariff_action": "new_tariff",
    "effective_date": "2025-07-31",
    "source_url": "https://ustr.gov/about/policy-offices/press-office/blogs-and-op-eds/2025/year-tariff",
    "source_name": "USTR",
    "published_date": "2026-03-04T18:50:51+00:00",
    "extracted_date": "2026-03-05T09:51:08.616520+00:00",
    "certainty_level": 5,
    "certainty_label": "EXECUTIVE_ORDER",
    "certainty_rationale": "The claim describes a presidential action ('the president established') with a specific effective date and concrete tariff rate, sourced from official USTR communications, indicating an executive action rather than a formal rule publication or law.",
    "pedigree": {
      "source_name": "USTR",
      "source_category": "official_us_gov",
      "source_url": "https://ustr.gov/about/policy-offices/press-office/blogs-and-op-eds/2025/year-tariff",
      "published_date": "2026-03-04T18:50:51+00:00",
      "extracted_date": "2026-03-05T09:51:08.616520+00:00",
      "certainty_level": 5
    },
    "feed_exclude": false
  },
  {
    "claim_id": "1c5f7567-c369-4fac-8435-23913854c077",
    "claim_text": "On July 31, the president established higher tariffs for countries with which the US has large trade deficits.",
    "subject": "Countries with which the US has large trade deficits",
    "tariff_action": "new_tariff",
    "effective_date": "2025-07-31",
    "source_url": "https://ustr.gov/about/policy-offices/press-office/blogs-and-op-eds/2025/year-tariff",
    "source_name": "USTR",
    "published_date": "2026-03-04T18:50:51+00:00",
    "extracted_date": "2026-03-05T09:51:08.616520+00:00",
    "certainty_level": 4,
    "certainty_label": "ANNOUNCED",
    "certainty_rationale": "An official announcement by USTR (a US government agency) of a specific presidential action on a specific date establishes certainty at the ANNOUNCED level, below EXECUTIVE_ORDER because the claim does not explicitly reference a signed executive order or proclamation document.",
    "pedigree": {
      "source_name": "USTR",
      "source_category": "official_us_gov",
      "source_url": "https://ustr.gov/about/policy-offices/press-office/blogs-and-op-eds/2025/year-tariff",
      "published_date": "2026-03-04T18:50:51+00:00",
      "extracted_date": "2026-03-05T09:51:08.616520+00:00",
      "certainty_level": 4
    },
    "feed_exclude": false
  },
  {
    "claim_id": "0503c751-836f-46d8-8185-d5bbf7e7f2ef",
    "claim_text": "The U.S. Department of Commerce preliminarily determined that countervailable subsidies were provided to Hyundai Steel Company and POSCO for certain cold-rolled steel flat products from the Republic of Korea during the period of January 1, 2023, through December 31, 2023.",
    "subject": "Cold-rolled steel flat products from Republic of Korea (Hyundai Steel Company and POSCO)",
    "tariff_action": "investigation_opened",
    "effective_date": null,
    "source_url": "https://www.federalregister.gov/documents/2026/03/05/2026-04328/certain-cold-rolled-steel-flat-products-from-republic-of-korea-preliminary-results-and-rescission-in",
    "source_name": "Federal Register",
    "published_date": "2026-03-05T05:00:00+00:00",
    "extracted_date": "2026-03-05T09:51:08.616520+00:00",
    "certainty_level": 3,
    "certainty_label": "PROPOSED",
    "certainty_rationale": "A preliminary determination by Commerce is an intermediate stage in the CVD investigation process, published in the Federal Register but not yet a final rule, representing a formal proposal subject to public comment before final determination.",
    "pedigree": {
      "source_name": "Federal Register",
      "source_category": "official_us_gov",
      "source_url": "https://www.federalregister.gov/documents/2026/03/05/2026-04328/certain-cold-rolled-steel-flat-products-from-republic-of-korea-preliminary-results-and-rescission-in",
      "published_date": "2026-03-05T05:00:00+00:00",
      "extracted_date": "2026-03-05T09:51:08.616520+00:00",
      "certainty_level": 3
    },
    "feed_exclude": true
  }
]