[
  {
    "claim_id": "fr_20260130_0076",
    "claim_text": "Certain Freight Rail Couplers and Parts Thereof From Mexico: Preliminary Results and Partial Rescission of Antidumping Duty Administrative Review; 2023-2024. The U.S. Department of Commerce (Commerce) is conducting an administrative review of the antidumping duty order on certain freight rail couplers and parts thereof (freight rail couplers) from Mexico. The period of review (POR) is May 3, 2023, through October 31, 2024. Commerce preliminarily determines that Amsted Rail Company, Inc.; ASF-K de Mexico, S. de R.L. de C.V. (Amsted) made sales of subjec",
    "subject": "Certain Freight Rail Couplers and Parts Thereof From Mexico: Preliminary Results and Partial Rescission of Antidumping Duty Administrative Review; 2023-2024",
    "tariff_action": "investigation_opened",
    "effective_date": null,
    "source_url": "https://www.federalregister.gov/documents/2026/01/30/2026-01811/certain-freight-rail-couplers-and-parts-thereof-from-mexico-preliminary-results-and-partial",
    "source_name": "Federal Register",
    "published_date": "2026-01-30",
    "extracted_date": "2026-03-05",
    "certainty_level": 4,
    "certainty_label": "ANNOUNCED",
    "certainty_rationale": "Federal Register Notice document #2026-01811.",
    "pedigree": {
      "source_name": "Federal Register",
      "source_category": "official_us_gov",
      "source_url": "https://www.federalregister.gov/documents/2026/01/30/2026-01811/certain-freight-rail-couplers-and-parts-thereof-from-mexico-preliminary-results-and-partial",
      "published_date": "2026-01-30",
      "extracted_date": "2026-03-05",
      "certainty_level": 4
    }
  }
]