[
  {
    "claim_id": "fr_20260213_0004",
    "claim_text": "Calcium Hypochlorite From the People's Republic of China: Continuation of Antidumping and Countervailing Duty Orders. As a result of the determinations by the U.S. Department of Commerce (Commerce) and the U.S. International Trade Commission (ITC) that revocation of the antidumping duty (AD) and countervailing duty (CVD) orders on calcium hypochlorite from the People's Republic of China would likely lead to the continuation or recurrence of dumping, countervailable subsidies, and material injury to an industry in",
    "subject": "Calcium Hypochlorite From the People's Republic of China: Continuation of Antidumping and Countervailing Duty Orders",
    "tariff_action": "tariff_removal",
    "effective_date": null,
    "source_url": "https://www.federalregister.gov/documents/2026/02/13/2026-02951/calcium-hypochlorite-from-the-peoples-republic-of-china-continuation-of-antidumping-and",
    "source_name": "Federal Register",
    "published_date": "2026-02-13",
    "extracted_date": "2026-03-05",
    "certainty_level": 4,
    "certainty_label": "ANNOUNCED",
    "certainty_rationale": "Federal Register Notice document #2026-02951.",
    "pedigree": {
      "source_name": "Federal Register",
      "source_category": "official_us_gov",
      "source_url": "https://www.federalregister.gov/documents/2026/02/13/2026-02951/calcium-hypochlorite-from-the-peoples-republic-of-china-continuation-of-antidumping-and",
      "published_date": "2026-02-13",
      "extracted_date": "2026-03-05",
      "certainty_level": 4
    }
  },
  {
    "claim_id": "fr_20260213_0006",
    "claim_text": "Rescission of Antidumping and Countervailing Duty Administrative Reviews. Based upon the timely withdrawal of all review requests, the U.S. Department of Commerce (Commerce) is rescinding the administrative reviews covering the periods of review (PORs) of the antidumping duty (AD) and countervailing duty (CVD) orders identified in the table below.",
    "subject": "Rescission of Antidumping and Countervailing Duty Administrative Reviews",
    "tariff_action": "investigation_opened",
    "effective_date": null,
    "source_url": "https://www.federalregister.gov/documents/2026/02/13/2026-02959/rescission-of-antidumping-and-countervailing-duty-administrative-reviews",
    "source_name": "Federal Register",
    "published_date": "2026-02-13",
    "extracted_date": "2026-03-05",
    "certainty_level": 4,
    "certainty_label": "ANNOUNCED",
    "certainty_rationale": "Federal Register Notice document #2026-02959.",
    "pedigree": {
      "source_name": "Federal Register",
      "source_category": "official_us_gov",
      "source_url": "https://www.federalregister.gov/documents/2026/02/13/2026-02959/rescission-of-antidumping-and-countervailing-duty-administrative-reviews",
      "published_date": "2026-02-13",
      "extracted_date": "2026-03-05",
      "certainty_level": 4
    }
  },
  {
    "claim_id": "fr_20260213_0109",
    "claim_text": "Ripe Olives From Spain: Preliminary Results of Antidumping Duty Administrative Review, and Partial Rescission of Review; 2023-2024. The U.S. Department of Commerce (Commerce) preliminarily finds that producers/exporters subject to this administrative review made sales of subject merchandise at less than normal value during the period of review (POR), August 1, 2023, through July 31, 2024. In addition, we are rescinding the administrative review with respect to one company. We invite interested parties to comment on these preli",
    "subject": "Ripe Olives From Spain: Preliminary Results of Antidumping Duty Administrative Review, and Partial Rescission of Review; 2023-2024",
    "tariff_action": "investigation_opened",
    "effective_date": null,
    "source_url": "https://www.federalregister.gov/documents/2026/02/13/2026-02875/ripe-olives-from-spain-preliminary-results-of-antidumping-duty-administrative-review-and-partial",
    "source_name": "Federal Register",
    "published_date": "2026-02-13",
    "extracted_date": "2026-03-05",
    "certainty_level": 4,
    "certainty_label": "ANNOUNCED",
    "certainty_rationale": "Federal Register Notice document #2026-02875.",
    "pedigree": {
      "source_name": "Federal Register",
      "source_category": "official_us_gov",
      "source_url": "https://www.federalregister.gov/documents/2026/02/13/2026-02875/ripe-olives-from-spain-preliminary-results-of-antidumping-duty-administrative-review-and-partial",
      "published_date": "2026-02-13",
      "extracted_date": "2026-03-05",
      "certainty_level": 4
    }
  },
  {
    "claim_id": "fr_20260213_0112",
    "claim_text": "Carbazole Violet Pigment 23 From India: Preliminary Results and Partial Rescission of Antidumping Duty Administrative Review; 2023-2024. The U.S. Department of Commerce (Commerce) preliminarily determines that Western Chemical Industries P Limited did not make sales of subject merchandise at prices below normal value. The period of review (POR) is December 1, 2023, through November 30, 2024. In addition, we are rescinding this review, in part, with respect to Meghmani Pigments. We invite interested parties to comment on these preli",
    "subject": "Carbazole Violet Pigment 23 From India: Preliminary Results and Partial Rescission of Antidumping Duty Administrative Review; 2023-2024",
    "tariff_action": "investigation_opened",
    "effective_date": null,
    "source_url": "https://www.federalregister.gov/documents/2026/02/13/2026-02878/carbazole-violet-pigment-23-from-india-preliminary-results-and-partial-rescission-of-antidumping",
    "source_name": "Federal Register",
    "published_date": "2026-02-13",
    "extracted_date": "2026-03-05",
    "certainty_level": 4,
    "certainty_label": "ANNOUNCED",
    "certainty_rationale": "Federal Register Notice document #2026-02878.",
    "pedigree": {
      "source_name": "Federal Register",
      "source_category": "official_us_gov",
      "source_url": "https://www.federalregister.gov/documents/2026/02/13/2026-02878/carbazole-violet-pigment-23-from-india-preliminary-results-and-partial-rescission-of-antidumping",
      "published_date": "2026-02-13",
      "extracted_date": "2026-03-05",
      "certainty_level": 4
    }
  },
  {
    "claim_id": "gdelt_20260213_0152",
    "claim_text": "US Tariff Changes Widen Competitive Gap for Developing Nations : UNCTAD Report",
    "subject": "US Tariff Changes Widen Competitive Gap for Developing Nations : UNCTAD Report",
    "tariff_action": "other",
    "effective_date": null,
    "source_url": "https://www.downtoearth.org.in/economy/us-tariff-shift-deepens-developing-countries-competitive-disadvantage-unctad",
    "source_name": "downtoearth.org.in",
    "published_date": "2026-02-13",
    "extracted_date": "2026-03-05",
    "certainty_level": 2,
    "certainty_label": "REPORTED",
    "certainty_rationale": "News report from downtoearth.org.in via GDELT.",
    "pedigree": {
      "source_name": "downtoearth.org.in",
      "source_category": "news_wire",
      "source_url": "https://www.downtoearth.org.in/economy/us-tariff-shift-deepens-developing-countries-competitive-disadvantage-unctad",
      "published_date": "2026-02-13",
      "extracted_date": "2026-03-05",
      "certainty_level": 2
    }
  },
  {
    "claim_id": "gdelt_20260213_0178",
    "claim_text": "Luhut confident on tariffs talk result , says Trump respects Prabowo",
    "subject": "Luhut confident on tariffs talk result , says Trump respects Prabowo",
    "tariff_action": "other",
    "effective_date": null,
    "source_url": "https://en.antaranews.com/news/404410/luhut-confident-on-tariffs-talk-result-says-trump-respects-prabowo",
    "source_name": "en.antaranews.com",
    "published_date": "2026-02-13",
    "extracted_date": "2026-03-05",
    "certainty_level": 2,
    "certainty_label": "REPORTED",
    "certainty_rationale": "News report from en.antaranews.com via GDELT.",
    "pedigree": {
      "source_name": "en.antaranews.com",
      "source_category": "news_wire",
      "source_url": "https://en.antaranews.com/news/404410/luhut-confident-on-tariffs-talk-result-says-trump-respects-prabowo",
      "published_date": "2026-02-13",
      "extracted_date": "2026-03-05",
      "certainty_level": 2
    }
  }
]