[
  {
    "claim_id": "fr_20260204_0056",
    "claim_text": "Oil Country Tubular Goods From India, South Korea, Turkey, Ukraine, and Vietnam; Notice of Commission Determination To Conduct Full Five-Year Reviews. The Commission hereby gives notice that it will proceed with full reviews pursuant to the Tariff Act of 1930 to determine whether revocation of the countervailing duty orders on oil country tubular goods from India and Turkey and the antidumping duty orders on oil country tubular goods from India, South Korea, Turkey, Ukraine, and Vietnam would be likely to lead to continuation or recurrence of ma",
    "subject": "Oil Country Tubular Goods From India, South Korea, Turkey, Ukraine, and Vietnam; Notice of Commission Determination To Conduct Full Five-Year Reviews",
    "tariff_action": "investigation_opened",
    "effective_date": null,
    "source_url": "https://www.federalregister.gov/documents/2026/02/04/2026-02210/oil-country-tubular-goods-from-india-south-korea-turkey-ukraine-and-vietnam-notice-of-commission",
    "source_name": "Federal Register",
    "published_date": "2026-02-04",
    "extracted_date": "2026-03-05",
    "certainty_level": 4,
    "certainty_label": "ANNOUNCED",
    "certainty_rationale": "Federal Register Notice document #2026-02210.",
    "pedigree": {
      "source_name": "Federal Register",
      "source_category": "official_us_gov",
      "source_url": "https://www.federalregister.gov/documents/2026/02/04/2026-02210/oil-country-tubular-goods-from-india-south-korea-turkey-ukraine-and-vietnam-notice-of-commission",
      "published_date": "2026-02-04",
      "extracted_date": "2026-03-05",
      "certainty_level": 4
    }
  }
]