[
  {
    "claim_id": "fr_20260109_0077",
    "claim_text": "Certain Steel Nails From the Sultanate of Oman: Preliminary Results and Rescission, in Part, of Antidumping Duty Administrative Review; 2023-2024. The U.S. Department of Commerce (Commerce) is conducting an administrative review of the antidumping duty (AD) order on certain steel nails (steel nails) from the Sultanate of Oman (Oman). This review covers 15 exporters and producers from Oman. The period of review (POR) is July 1, 2023, through June 30, 2024. The sole mandatory respondent in this review is Oman Fasteners, LLC (Oman Fasteners). C",
    "subject": "Certain Steel Nails From the Sultanate of Oman: Preliminary Results and Rescission, in Part, of Antidumping Duty Administrative Review; 2023-2024",
    "tariff_action": "tariff_pause",
    "effective_date": null,
    "source_url": "https://www.federalregister.gov/documents/2026/01/09/2026-00256/certain-steel-nails-from-the-sultanate-of-oman-preliminary-results-and-rescission-in-part-of",
    "source_name": "Federal Register",
    "published_date": "2026-01-09",
    "extracted_date": "2026-03-05",
    "certainty_level": 4,
    "certainty_label": "ANNOUNCED",
    "certainty_rationale": "Federal Register Notice document #2026-00256.",
    "pedigree": {
      "source_name": "Federal Register",
      "source_category": "official_us_gov",
      "source_url": "https://www.federalregister.gov/documents/2026/01/09/2026-00256/certain-steel-nails-from-the-sultanate-of-oman-preliminary-results-and-rescission-in-part-of",
      "published_date": "2026-01-09",
      "extracted_date": "2026-03-05",
      "certainty_level": 4
    }
  },
  {
    "claim_id": "fr_20260109_0128",
    "claim_text": "Xanthan Gum From the People's Republic of China: Preliminary Results of the Antidumping Duty Administrative Review, Rescission, in Part, and Preliminary Determination of No Shipments; 2023-2024. The U.S. Department of Commerce (Commerce) preliminarily determines that both of the exporters under review did not make sales of subject merchandise at less than normal value and that Deosen Biochemical Ltd. had no shipments of subject merchandise during the period of review (POR) July 1, 2023, through June 30, 2024. In addition, we are rescinding this review, in part, with respect to CP Kelco (S",
    "subject": "Xanthan Gum From the People's Republic of China: Preliminary Results of the Antidumping Duty Administrative Review, Rescission, in Part, and Preliminary Determination of No Shipments; 2023-2024",
    "tariff_action": "investigation_opened",
    "effective_date": null,
    "source_url": "https://www.federalregister.gov/documents/2026/01/09/2026-00212/xanthan-gum-from-the-peoples-republic-of-china-preliminary-results-of-the-antidumping-duty",
    "source_name": "Federal Register",
    "published_date": "2026-01-09",
    "extracted_date": "2026-03-05",
    "certainty_level": 4,
    "certainty_label": "ANNOUNCED",
    "certainty_rationale": "Federal Register Notice document #2026-00212.",
    "pedigree": {
      "source_name": "Federal Register",
      "source_category": "official_us_gov",
      "source_url": "https://www.federalregister.gov/documents/2026/01/09/2026-00212/xanthan-gum-from-the-peoples-republic-of-china-preliminary-results-of-the-antidumping-duty",
      "published_date": "2026-01-09",
      "extracted_date": "2026-03-05",
      "certainty_level": 4
    }
  },
  {
    "claim_id": "fr_20260109_0133",
    "claim_text": "Polyethylene Terephthalate Film, Sheet, and Strip From India: Preliminary Results and Rescission, in Part, of Antidumping Duty Administrative Review; 2023-2024. The U.S. Department of Commerce (Commerce) preliminarily determines that Cosmo First Limited (Cosmo) made sales of subject merchandise at less than normal value during the period of review (POR) July 1, 2023, through June 30, 2024. Additionally, Commerce is rescinding the review, in part, with respect to eight companies. We invite interested parties to comment on these preliminary results.",
    "subject": "Polyethylene Terephthalate Film, Sheet, and Strip From India: Preliminary Results and Rescission, in Part, of Antidumping Duty Administrative Review; 2023-2024",
    "tariff_action": "investigation_opened",
    "effective_date": null,
    "source_url": "https://www.federalregister.gov/documents/2026/01/09/2026-00225/polyethylene-terephthalate-film-sheet-and-strip-from-india-preliminary-results-and-rescission-in",
    "source_name": "Federal Register",
    "published_date": "2026-01-09",
    "extracted_date": "2026-03-05",
    "certainty_level": 4,
    "certainty_label": "ANNOUNCED",
    "certainty_rationale": "Federal Register Notice document #2026-00225.",
    "pedigree": {
      "source_name": "Federal Register",
      "source_category": "official_us_gov",
      "source_url": "https://www.federalregister.gov/documents/2026/01/09/2026-00225/polyethylene-terephthalate-film-sheet-and-strip-from-india-preliminary-results-and-rescission-in",
      "published_date": "2026-01-09",
      "extracted_date": "2026-03-05",
      "certainty_level": 4
    }
  },
  {
    "claim_id": "gdelt_20260109_0104",
    "claim_text": "Pakistan electricity tariff slabs for 2026 remain unchanged : Category - wise unit rates",
    "subject": "Pakistan electricity tariff slabs for 2026 remain unchanged : Category - wise unit rates",
    "tariff_action": "other",
    "effective_date": null,
    "source_url": "https://pakobserver.net/pakistan-electricity-tariff-slabs-for-2026-remain-unchanged-category-wise-unit-rates/",
    "source_name": "pakobserver.net",
    "published_date": "2026-01-09",
    "extracted_date": "2026-03-05",
    "certainty_level": 2,
    "certainty_label": "REPORTED",
    "certainty_rationale": "News report from pakobserver.net via GDELT.",
    "pedigree": {
      "source_name": "pakobserver.net",
      "source_category": "news_wire",
      "source_url": "https://pakobserver.net/pakistan-electricity-tariff-slabs-for-2026-remain-unchanged-category-wise-unit-rates/",
      "published_date": "2026-01-09",
      "extracted_date": "2026-03-05",
      "certainty_level": 2
    }
  }
]