[
  {
    "claim_id": "6ed185a1-0ac3-415d-b541-30cf17bc6bca",
    "claim_text": "On July 31, 2025, the president established a new tariff structure: 10 percent tariffs on countries with which the US runs a surplus, 15 percent tariffs on countries with which it has a small deficit, and higher tariffs for countries with which the US has large trade deficits.",
    "subject": "Multiple countries based on trade balance status",
    "tariff_action": "new_tariff",
    "effective_date": "2025-07-31",
    "source_url": "https://ustr.gov/about/policy-offices/press-office/blogs-and-op-eds/2025/year-tariff",
    "source_name": "USTR",
    "published_date": "2026-03-04T18:50:51+00:00",
    "extracted_date": "2026-03-05T06:50:09.374404+00:00",
    "certainty_level": 4,
    "certainty_label": "ANNOUNCED",
    "certainty_rationale": "The claim describes a specific tariff structure established by the president on a named date, sourced from official USTR press materials, which constitutes a formal government announcement but lacks evidence of signed executive order documentation or Federal Register publication.",
    "pedigree": {
      "source_name": "USTR",
      "source_category": "official_us_gov",
      "source_url": "https://ustr.gov/about/policy-offices/press-office/blogs-and-op-eds/2025/year-tariff",
      "published_date": "2026-03-04T18:50:51+00:00",
      "extracted_date": "2026-03-05T06:50:09.374404+00:00",
      "certainty_level": 4
    }
  }
]