[
  {
    "claim_id": "fr_20260123_0005",
    "claim_text": "Lightweight Thermal Paper From the People's Republic of China: Continuation of Antidumping Duty and Countervailing Duty Orders. As a result of the determinations by the U.S. Department of Commerce (Commerce) and the U.S. International Trade Commission (ITC) that revocation of the antidumping duty (AD) order and the countervailing duty (CVD) order on lightweight thermal paper from the People's Republic of China (China) would likely lead to the continuation or recurrence of dumping, countervailable subsidies, and material in",
    "subject": "Lightweight Thermal Paper From the People's Republic of China: Continuation of Antidumping Duty and Countervailing Duty Orders",
    "tariff_action": "tariff_removal",
    "effective_date": null,
    "source_url": "https://www.federalregister.gov/documents/2026/01/23/2026-01283/lightweight-thermal-paper-from-the-peoples-republic-of-china-continuation-of-antidumping-duty-and",
    "source_name": "Federal Register",
    "published_date": "2026-01-23",
    "extracted_date": "2026-03-05",
    "certainty_level": 4,
    "certainty_label": "ANNOUNCED",
    "certainty_rationale": "Federal Register Notice document #2026-01283.",
    "pedigree": {
      "source_name": "Federal Register",
      "source_category": "official_us_gov",
      "source_url": "https://www.federalregister.gov/documents/2026/01/23/2026-01283/lightweight-thermal-paper-from-the-peoples-republic-of-china-continuation-of-antidumping-duty-and",
      "published_date": "2026-01-23",
      "extracted_date": "2026-03-05",
      "certainty_level": 4
    }
  },
  {
    "claim_id": "fr_20260123_0009",
    "claim_text": "Overhead Door Counterbalance Torsion Springs From the People's Republic of China: Antidumping Duty Order and Countervailing Duty Order. Based on affirmative final determinations by the U.S Department of Commerce (Commerce) and the U.S. International Trade Commission (ITC), Commerce is issuing antidumping duty (AD) and countervailing duty (CVD) orders on overhead door counterbalance torsion springs (overhead door springs) from the People's Republic of China.",
    "subject": "Overhead Door Counterbalance Torsion Springs From the People's Republic of China: Antidumping Duty Order and Countervailing Duty Order",
    "tariff_action": "new_tariff",
    "effective_date": null,
    "source_url": "https://www.federalregister.gov/documents/2026/01/23/2026-01282/overhead-door-counterbalance-torsion-springs-from-the-peoples-republic-of-china-antidumping-duty",
    "source_name": "Federal Register",
    "published_date": "2026-01-23",
    "extracted_date": "2026-03-05",
    "certainty_level": 6,
    "certainty_label": "RULE_PUBLISHED",
    "certainty_rationale": "Federal Register Notice document #2026-01282.",
    "pedigree": {
      "source_name": "Federal Register",
      "source_category": "official_us_gov",
      "source_url": "https://www.federalregister.gov/documents/2026/01/23/2026-01282/overhead-door-counterbalance-torsion-springs-from-the-peoples-republic-of-china-antidumping-duty",
      "published_date": "2026-01-23",
      "extracted_date": "2026-03-05",
      "certainty_level": 6
    }
  },
  {
    "claim_id": "fr_20260123_0113",
    "claim_text": "Notice of Extension of the Deadline for Determining the Adequacy of the Antidumping Duty Petition: Fresh Winter Strawberries From Mexico",
    "subject": "Extension of the Deadline for Determining the Adequacy of the Antidumping Duty Petition: Fresh Winter Strawberries From Mexico",
    "tariff_action": "new_tariff",
    "effective_date": null,
    "source_url": "https://www.federalregister.gov/documents/2026/01/23/2026-01214/notice-of-extension-of-the-deadline-for-determining-the-adequacy-of-the-antidumping-duty-petition",
    "source_name": "Federal Register",
    "published_date": "2026-01-23",
    "extracted_date": "2026-03-05",
    "certainty_level": 4,
    "certainty_label": "ANNOUNCED",
    "certainty_rationale": "Federal Register Notice document #2026-01214.",
    "pedigree": {
      "source_name": "Federal Register",
      "source_category": "official_us_gov",
      "source_url": "https://www.federalregister.gov/documents/2026/01/23/2026-01214/notice-of-extension-of-the-deadline-for-determining-the-adequacy-of-the-antidumping-duty-petition",
      "published_date": "2026-01-23",
      "extracted_date": "2026-03-05",
      "certainty_level": 4
    }
  },
  {
    "claim_id": "fr_20260123_0125",
    "claim_text": "Organic Soybean Meal From India: Final Results of Antidumping Duty Administrative Review; 2023-2024. The U.S. Department of Commerce (Commerce) determines that Tejawat Organic Foods, the sole producer/exporter subject to this administrative review, made sales of organic soybean meal (soybean meal) from India in the United States at prices below normal value (NV) during the period of review. The period of review (POR) is May 1, 2023, through April 30, 2024.",
    "subject": "Organic Soybean Meal From India: Final Results of Antidumping Duty Administrative Review; 2023-2024",
    "tariff_action": "investigation_opened",
    "effective_date": null,
    "source_url": "https://www.federalregister.gov/documents/2026/01/23/2026-01218/organic-soybean-meal-from-india-final-results-of-antidumping-duty-administrative-review-2023-2024",
    "source_name": "Federal Register",
    "published_date": "2026-01-23",
    "extracted_date": "2026-03-05",
    "certainty_level": 4,
    "certainty_label": "ANNOUNCED",
    "certainty_rationale": "Federal Register Notice document #2026-01218.",
    "pedigree": {
      "source_name": "Federal Register",
      "source_category": "official_us_gov",
      "source_url": "https://www.federalregister.gov/documents/2026/01/23/2026-01218/organic-soybean-meal-from-india-final-results-of-antidumping-duty-administrative-review-2023-2024",
      "published_date": "2026-01-23",
      "extracted_date": "2026-03-05",
      "certainty_level": 4
    }
  },
  {
    "claim_id": "fr_20260123_0127",
    "claim_text": "Utility Scale Wind Towers From the Republic of Korea: Preliminary Results and Rescission, in Part, of Antidumping Duty Administrative Review; 2023-2024. The U.S. Department of Commerce (Commerce) preliminarily determines that sales of utility scale wind towers (wind towers) from the Republic of Korea (Korea) were made at less than normal value (NV) during the period of review (POR) August 1, 2023, through July 31, 2024. Additionally, Commerce is rescinding this administrative review, in part, with respect to certain companies that had no entries o",
    "subject": "Utility Scale Wind Towers From the Republic of Korea: Preliminary Results and Rescission, in Part, of Antidumping Duty Administrative Review; 2023-2024",
    "tariff_action": "investigation_opened",
    "effective_date": null,
    "source_url": "https://www.federalregister.gov/documents/2026/01/23/2026-01280/utility-scale-wind-towers-from-the-republic-of-korea-preliminary-results-and-rescission-in-part-of",
    "source_name": "Federal Register",
    "published_date": "2026-01-23",
    "extracted_date": "2026-03-05",
    "certainty_level": 4,
    "certainty_label": "ANNOUNCED",
    "certainty_rationale": "Federal Register Notice document #2026-01280.",
    "pedigree": {
      "source_name": "Federal Register",
      "source_category": "official_us_gov",
      "source_url": "https://www.federalregister.gov/documents/2026/01/23/2026-01280/utility-scale-wind-towers-from-the-republic-of-korea-preliminary-results-and-rescission-in-part-of",
      "published_date": "2026-01-23",
      "extracted_date": "2026-03-05",
      "certainty_level": 4
    }
  }
]