[
  {
    "claim_id": "fr_20260218_0053",
    "claim_text": "Fresh Tomatoes From Mexico: Final Clarification of the Scope of the Antidumping Duty Order. On December 22, 2025, the U.S. Department of Commerce (Commerce) issued a proposed clarification of the scope of the antidumping duty (AD) order on fresh tomatoes from Mexico. Based on comments from interested parties, Commerce has further clarified the scope of this order.",
    "subject": "Fresh Tomatoes From Mexico: Final Clarification of the Scope of the Antidumping Duty Order",
    "tariff_action": "rule_proposed",
    "effective_date": null,
    "source_url": "https://www.federalregister.gov/documents/2026/02/18/2026-03195/fresh-tomatoes-from-mexico-final-clarification-of-the-scope-of-the-antidumping-duty-order",
    "source_name": "Federal Register",
    "published_date": "2026-02-18",
    "extracted_date": "2026-03-05",
    "certainty_level": 4,
    "certainty_label": "ANNOUNCED",
    "certainty_rationale": "Federal Register Notice document #2026-03195.",
    "pedigree": {
      "source_name": "Federal Register",
      "source_category": "official_us_gov",
      "source_url": "https://www.federalregister.gov/documents/2026/02/18/2026-03195/fresh-tomatoes-from-mexico-final-clarification-of-the-scope-of-the-antidumping-duty-order",
      "published_date": "2026-02-18",
      "extracted_date": "2026-03-05",
      "certainty_level": 4
    }
  },
  {
    "claim_id": "fr_20260218_0058",
    "claim_text": "Certain Corrosion-Resistant Steel Products From the Republic of Korea: Final Results of Countervailing Duty Changed Circumstances Review. The U.S. Department of Commerce (Commerce) determines that a producer/exporter subject the countervailing duty (CVD) order on certain corrosion-resistant steel products (CORE) from the Republic of Korea (Korea), Dongkuk Coated Metal Co., Ltd. (Dongkuk CM), is not the Successor-in-Interest (SII) to Dongkuk Steel Mill Co., Ltd. (Old Dongkuk Steel) in the context of the CVD order on CORE from Korea.",
    "subject": "Certain Corrosion-Resistant Steel Products From the Republic of Korea: Final Results of Countervailing Duty Changed Circumstances Review",
    "tariff_action": "investigation_opened",
    "effective_date": null,
    "source_url": "https://www.federalregister.gov/documents/2026/02/18/2026-03207/certain-corrosion-resistant-steel-products-from-the-republic-of-korea-final-results-of",
    "source_name": "Federal Register",
    "published_date": "2026-02-18",
    "extracted_date": "2026-03-05",
    "certainty_level": 4,
    "certainty_label": "ANNOUNCED",
    "certainty_rationale": "Federal Register Notice document #2026-03207.",
    "pedigree": {
      "source_name": "Federal Register",
      "source_category": "official_us_gov",
      "source_url": "https://www.federalregister.gov/documents/2026/02/18/2026-03207/certain-corrosion-resistant-steel-products-from-the-republic-of-korea-final-results-of",
      "published_date": "2026-02-18",
      "extracted_date": "2026-03-05",
      "certainty_level": 4
    }
  },
  {
    "claim_id": "fr_20260218_0081",
    "claim_text": "Certain Aluminum Foil From the People's Republic of China: Final Results of Countervailing Duty Administrative Review; 2023. The U.S. Department of Commerce (Commerce) determines that countervailable subsidies were provided to certain exporters/producers of certain aluminum foil (aluminum foil) from the People's Republic of China (China) during the period of review (POR) January 1, 2023, through December 31, 2023.",
    "subject": "Certain Aluminum Foil From the People's Republic of China: Final Results of Countervailing Duty Administrative Review; 2023",
    "tariff_action": "investigation_opened",
    "effective_date": null,
    "source_url": "https://www.federalregister.gov/documents/2026/02/18/2026-03205/certain-aluminum-foil-from-the-peoples-republic-of-china-final-results-of-countervailing-duty",
    "source_name": "Federal Register",
    "published_date": "2026-02-18",
    "extracted_date": "2026-03-05",
    "certainty_level": 4,
    "certainty_label": "ANNOUNCED",
    "certainty_rationale": "Federal Register Notice document #2026-03205.",
    "pedigree": {
      "source_name": "Federal Register",
      "source_category": "official_us_gov",
      "source_url": "https://www.federalregister.gov/documents/2026/02/18/2026-03205/certain-aluminum-foil-from-the-peoples-republic-of-china-final-results-of-countervailing-duty",
      "published_date": "2026-02-18",
      "extracted_date": "2026-03-05",
      "certainty_level": 4
    }
  },
  {
    "claim_id": "fr_20260218_0115",
    "claim_text": "Stainless Steel Flanges From India: Preliminary Results and Rescission, in Part, of Antidumping Duty Administrative Review; 2023-2024. The U.S. Department of Commerce (Commerce) preliminarily finds that producers and/or exporters of stainless steel flanges (flanges) from India made sales of subject merchandise in the United States at prices below normal value (NV) during the period of review (POR) October 1, 2023, through September 30, 2024. In addition, we are rescinding this review for two companies. We invite interested partie",
    "subject": "Stainless Steel Flanges From India: Preliminary Results and Rescission, in Part, of Antidumping Duty Administrative Review; 2023-2024",
    "tariff_action": "investigation_opened",
    "effective_date": null,
    "source_url": "https://www.federalregister.gov/documents/2026/02/18/2026-03202/stainless-steel-flanges-from-india-preliminary-results-and-rescission-in-part-of-antidumping-duty",
    "source_name": "Federal Register",
    "published_date": "2026-02-18",
    "extracted_date": "2026-03-05",
    "certainty_level": 4,
    "certainty_label": "ANNOUNCED",
    "certainty_rationale": "Federal Register Notice document #2026-03202.",
    "pedigree": {
      "source_name": "Federal Register",
      "source_category": "official_us_gov",
      "source_url": "https://www.federalregister.gov/documents/2026/02/18/2026-03202/stainless-steel-flanges-from-india-preliminary-results-and-rescission-in-part-of-antidumping-duty",
      "published_date": "2026-02-18",
      "extracted_date": "2026-03-05",
      "certainty_level": 4
    }
  },
  {
    "claim_id": "fr_20260218_0140",
    "claim_text": "Stainless Steel Bar From India: Final Results and Rescission, in Part, of Antidumping Duty Administrative Review; 2023-2024. The U.S. Department of Commerce (Commerce) determines that certain producers/exporters of stainless steel bar (SS Bar) from India made sales at prices below normal value during the period of review (POR), February 1, 2023, through January 31, 2024.",
    "subject": "Stainless Steel Bar From India: Final Results and Rescission, in Part, of Antidumping Duty Administrative Review; 2023-2024",
    "tariff_action": "investigation_opened",
    "effective_date": null,
    "source_url": "https://www.federalregister.gov/documents/2026/02/18/2026-03103/stainless-steel-bar-from-india-final-results-and-rescission-in-part-of-antidumping-duty",
    "source_name": "Federal Register",
    "published_date": "2026-02-18",
    "extracted_date": "2026-03-05",
    "certainty_level": 4,
    "certainty_label": "ANNOUNCED",
    "certainty_rationale": "Federal Register Notice document #2026-03103.",
    "pedigree": {
      "source_name": "Federal Register",
      "source_category": "official_us_gov",
      "source_url": "https://www.federalregister.gov/documents/2026/02/18/2026-03103/stainless-steel-bar-from-india-final-results-and-rescission-in-part-of-antidumping-duty",
      "published_date": "2026-02-18",
      "extracted_date": "2026-03-05",
      "certainty_level": 4
    }
  }
]